{
  "$schema": "./scoring-template.schema.json",
  "id": "portfolio-default",
  "name": "Portfolio Default",
  "description": "Default scoring template for all patents. Provides base questions that can be inherited and overridden by sector-specific templates.",
  "level": "portfolio",
  "isDefault": true,
  "version": 2,
  "scoringGuidance": [
    "Score each question on a 1-10 scale based on the patent's actual content.",
    "If a question topic is NOT addressed or NOT relevant to this patent, score 1-2 and state clearly in reasoning that this aspect is not applicable to this patent.",
    "If a question topic is minimally addressed, score 3-4.",
    "If a question topic is moderately addressed with some merit, score 5-6.",
    "If a question topic is well addressed with clear value, score 7-8.",
    "If a question topic is exceptionally addressed with significant innovation, score 9-10.",
    "Always provide specific reasoning citing patent content. Avoid generic statements."
  ],
  "questions": [
    {
      "fieldName": "technical_novelty",
      "displayName": "Technical Novelty",
      "question": "Rate the technical novelty of this patent's core innovation. Consider: How different is this from prior art? Does it represent a significant departure from existing approaches?",
      "answerType": "numeric",
      "scale": { "min": 1, "max": 10 },
      "weight": 0.20,
      "requiresReasoning": true,
      "reasoningPrompt": "Explain what makes this technically novel or incremental."
    },
    {
      "fieldName": "claim_breadth",
      "displayName": "Claim Breadth",
      "question": "Rate the breadth of the patent claims. Consider: How broadly do the claims cover the invention? Could they capture variations and alternative implementations?",
      "answerType": "numeric",
      "scale": { "min": 1, "max": 10 },
      "weight": 0.15,
      "requiresReasoning": true,
      "reasoningPrompt": "Describe the scope of the claims."
    },
    {
      "fieldName": "design_around_difficulty",
      "displayName": "Design-Around Difficulty",
      "question": "How difficult would it be for a competitor to design around this patent while achieving similar functionality?",
      "answerType": "numeric",
      "scale": { "min": 1, "max": 10 },
      "weight": 0.20,
      "requiresReasoning": true,
      "reasoningPrompt": "Explain what makes this hard or easy to design around."
    },
    {
      "fieldName": "market_relevance",
      "displayName": "Market Relevance",
      "question": "Rate the relevance of this technology to current market needs and industry trends.",
      "answerType": "numeric",
      "scale": { "min": 1, "max": 10 },
      "weight": 0.15,
      "requiresReasoning": true,
      "reasoningPrompt": "Describe the market context and relevance."
    },
    {
      "fieldName": "implementation_clarity",
      "displayName": "Implementation Clarity",
      "question": "How clearly does the patent describe the implementation? Could infringement be easily detected in a product?",
      "answerType": "numeric",
      "scale": { "min": 1, "max": 10 },
      "weight": 0.15,
      "requiresReasoning": true,
      "reasoningPrompt": "Assess detectability and clarity of implementation."
    },
    {
      "fieldName": "standards_relevance",
      "displayName": "Standards Relevance",
      "question": "Is this patent related to any industry standards (IEEE, 3GPP, IETF, etc.)? Rate its standards essentiality.",
      "answerType": "numeric",
      "scale": { "min": 1, "max": 10 },
      "weight": 0.15,
      "requiresReasoning": true,
      "reasoningPrompt": "Identify any standards relationships."
    },
    {
      "fieldName": "unique_value",
      "displayName": "Unique/Hidden Value",
      "question": "Beyond the standard metrics above, does this patent have unique or overlooked value that isn't captured by typical analysis? Consider: unusual claim scope, emerging technology applicability, underappreciated market timing, strategic defensive value, or any 'dark horse' characteristics that could make this patent more valuable than it appears.",
      "answerType": "numeric",
      "scale": { "min": 1, "max": 10 },
      "weight": 0.10,
      "requiresReasoning": true,
      "reasoningPrompt": "Identify any unique characteristics, hidden strengths, or overlooked value that distinguishes this patent from others in its sector. What makes this a potential 'dark horse' that standard analysis might miss? Be specific about what unique value exists and why it matters."
    },
    {
      "fieldName": "product_mapping_probability",
      "displayName": "Product Mapping Probability",
      "question": "Estimate the probability that this patent's claims read on commercially available products. Name likely product categories and specific companies whose products may implement the claimed technology. Consider publicly known product specifications, teardowns, and standards compliance.",
      "answerType": "numeric",
      "scale": { "min": 1, "max": 10 },
      "weight": 0,
      "requiresReasoning": true,
      "reasoningPrompt": "Name specific product categories and companies whose products likely implement this technology. Explain what evidence supports or undermines a product mapping."
    },
    {
      "fieldName": "evidence_of_use_detectability",
      "displayName": "Evidence of Use Detectability",
      "question": "Can infringement of this patent be detected without internal product access? Could evidence be gathered from observable product behavior, published specifications, standards compliance testing, FCC filings, teardown reports, or other publicly available sources?",
      "answerType": "numeric",
      "scale": { "min": 1, "max": 10 },
      "weight": 0,
      "requiresReasoning": true,
      "reasoningPrompt": "Describe what types of evidence could demonstrate use of the claimed technology and how accessible that evidence is. Distinguish between externally observable vs. requiring internal product access."
    },
    {
      "fieldName": "licensing_revenue_potential",
      "displayName": "Licensing Revenue Potential",
      "question": "Rate the commercial significance of this patent for licensing. Consider: Does it cover high-volume consumer products, critical infrastructure, or niche applications? What is the potential per-unit royalty basis and market size?",
      "answerType": "numeric",
      "scale": { "min": 1, "max": 10 },
      "weight": 0,
      "requiresReasoning": true,
      "reasoningPrompt": "Assess whether this patent covers high-volume consumer, infrastructure, or niche technology. Estimate the commercial significance and potential licensing revenue basis."
    },
    {
      "fieldName": "tech_component_classification",
      "displayName": "Tech Component Classification",
      "question": "What fundamental technology components does this patent address? Map the claimed invention to known technology building blocks (e.g., 'beamforming algorithm', 'video codec entropy coder', 'TLS handshake protocol'). List the 2-4 most relevant technology components.",
      "answerType": "numeric",
      "scale": { "min": 1, "max": 10 },
      "weight": 0,
      "requiresReasoning": true,
      "reasoningPrompt": "List 2-4 specific technology components this patent addresses. Use standard technology terminology that maps to known product building blocks. Rate how clearly the patent maps to identifiable components (10 = maps directly to a well-known component, 1 = too abstract to map)."
    }
  ]
}
